수정본 슬라이드 번호,indexL,indexS,index,isBranch,isEnd,nameTagType,hasLine,bgm,hasSoundEffect,soundEffectName,artIndex,speaker,line,branch1Line,branch2Line
424,3,4,21,0,0,3,1,4,0,-,164,트랜시,당신은 정말 대단한 세모군요... 감사합니다. 전쟁은 없을 겁니다. 이쪽으로 오세요. 제가 안내하죠.,,
425,3,4,22,0,0,0,0,4,1,Stabbing,165,,,,
426,3,4,23,0,0,0,0,4,1,Absorbing,166,,,,
150,3,4,24,0,0,1,1,4,0,-,64,스투키,"앨리, 이제 다들 원래대로 돌아오게 됐네.",,
151,3,4,25,0,0,2,1,3,0,-,64,앨리,...... ('다들 원래대로'?),,
152,3,4,26,0,0,1,1,3,0,-,65,스투키,하지만... 이제 우린 어쩌면 좋지?,,
153,3,4,27,0,0,2,1,3,0,-,65,앨리,"...이참에, 나도 모든 걸 되돌리겠어.",,
154,3,4,28,0,0,1,1,3,0,-,65,스투키,앨리? 그게 무슨 소리야?,,
155,3,4,29,0,0,2,1,3,0,-,65,앨리,"너도 알고 있잖아. 지금의 역사는 처음부터 잘못되었다는 걸.
써키님은 억울한 죽음을 당했고 그 이후로 동그라미들은 핍박 받는 삶을 살아왔어.",,
156,3,4,30,0,0,2,1,3,0,-,65,앨리,"나라가 혼란스러워진 지금이 적기야. 옳지 않았던 역사를 바꾸겠어. 스투키, 날 도와줄래?",,
157,3,4,31,1,0,1,1,3,0,-,65,스투키,,"응, 내가 함께 할게. 우린 친구잖아. 그리고 잘못된 건 바로잡아야 하니까.","...하지만 앨리, 당장은 나라의 혼란을 수습하는 게 우선이야. 그 이야기는 나중에 다시 해보자."